[
  {
    "versao_contrato": "1.0",
    "modelo_publico": "card_dados_v1",
    "id": "DAD-0008",
    "codigo_publicacao": "R001-C01",
    "evi_id": "EVI-ibge-pnad-informalidade-2026-t1",
    "tema_ids": [
      "trabalho"
    ],
    "editoria": "Notícias, dados e informações",
    "categoria": "Trabalho e desigualdade",
    "subtema": "Trabalho, informalidade e proteção social",
    "titulo": "Informalidade no Brasil no 1º trimestre de 2026",
    "subtitulo": "Mais de um terço da população ocupada estava em trabalhos informais",
    "tipo": "Dado oficial",
    "resumo": "No 1º trimestre de 2026, a informalidade alcançou 37,3% da população ocupada no Brasil. A PNAD Contínua também registrou 25,5% de trabalhadores por conta própria e taxa composta de subutilização de 14,3%. Os indicadores ajudam a distinguir ocupação, emprego formal, trabalho por conta própria e proteção social, sem tratar todas as experiências de trabalho informal como iguais.",
    "dado": "No 1º trimestre de 2026, 37,3% da população ocupada estava em trabalhos informais; 25,5% trabalhavam por conta própria; e a taxa composta de subutilização da força de trabalho foi de 14,3%.",
    "contextualizacao": "Os indicadores se referem ao 1º trimestre de 2026 e à população ocupada no Brasil. A PNAD Contínua é uma pesquisa amostral oficial do IBGE.",
    "interpretacao_sociosofia": "Os indicadores ajudam a distinguir ocupação, emprego formal, trabalho por conta própria e proteção social, sem tratar todas as experiências de trabalho informal como iguais.",
    "questao": "Ter uma ocupação significa necessariamente possuir vínculo formal e proteção social?",
    "conexoes": "Trabalho, informalidade, precarização, proteção social, cidadania e desigualdade estrutural.",
    "conceitos": [
      "Precarização",
      "Cidadania",
      "Desigualdade estrutural"
    ],
    "autores": [],
    "fonte_nome": "IBGE — PNAD Contínua Trimestral, 1º trimestre de 2026",
    "fonte_url": "https://agenciadenoticias.ibge.gov.br/agencia-sala-de-imprensa/2013-agencia-de-noticias/releases/46676-pnad-continua-trimestral-desocupacao-sobe-em-15-das-27-ufs-no-1-trimestre-de-2026",
    "ano_data": "2026",
    "confiabilidade": "Alta; estatística amostral oficial do IBGE",
    "fonte_status": "conferida",
    "nivel": "Básico",
    "status": "publicado",
    "aprovacao": {
      "status": "aprovado",
      "aprovado_por": "Luiz Jácomo"
    },
    "destaque": false,
    "tags": [
      "trabalho",
      "informalidade",
      "proteção social",
      "PNAD Contínua",
      "desigualdade"
    ]
  },
  {
    "versao_contrato": "1.0",
    "modelo_publico": "card_dados_v1",
    "id": "DAD-0009",
    "codigo_publicacao": "R002-C01",
    "evi_id": "EVI-datasenado-violencia-mulher-2025",
    "tema_ids": [
      "genero",
      "violencia"
    ],
    "editoria": "Notícias, dados e informações",
    "categoria": "Gênero, sexualidade e corpo",
    "subtema": "Violência de gênero e direitos",
    "titulo": "3,7 milhões de brasileiras sofreram violência doméstica ou familiar em um ano",
    "subtitulo": "A estimativa corresponde a 4% das mulheres com 16 anos ou mais",
    "tipo": "Pesquisa nacional",
    "resumo": "Na Pesquisa Nacional de Violência contra a Mulher de 2025, 3,7 milhões de brasileiras — 4% das mulheres com 16 anos ou mais — declararam ter sofrido violência doméstica ou familiar nos doze meses anteriores. O levantamento entrevistou 21.641 mulheres em todas as unidades da Federação. A escala do problema ajuda a compreender que a violência contra a mulher não é apenas um conflito privado, mas uma questão social que envolve relações de gênero, proteção institucional e garantia de direitos.",
    "dado": "Em 2025, 3,7 milhões de brasileiras, equivalentes a 4% das mulheres com 16 anos ou mais, declararam ter sofrido violência doméstica ou familiar nos doze meses anteriores à pesquisa.",
    "contextualizacao": "O levantamento entrevistou 21.641 mulheres em todas as unidades da Federação e considerou os doze meses anteriores à entrevista.",
    "interpretacao_sociosofia": "A escala do problema ajuda a compreender que a violência contra a mulher não é apenas um conflito privado, mas uma questão social que envolve relações de gênero, proteção institucional e garantia de direitos.",
    "questao": "Por que a violência contra a mulher deve ser tratada como problema social e público, e não apenas como conflito privado?",
    "conexoes": "Violência de gênero, patriarcado, naturalização da violência, cidadania, direitos humanos e políticas de proteção.",
    "conceitos": [
      "Violência de gênero",
      "Patriarcado",
      "Cidadania",
      "Direitos humanos"
    ],
    "autores": [],
    "fonte_nome": "DataSenado — Pesquisa Nacional de Violência contra a Mulher 2025",
    "fonte_url": "https://www12.senado.leg.br/institucional/datasenado/publicacaodatasenado?id=pesquisa-nacional-de-violencia-contra-a-mulher-datasenado-2025",
    "ano_data": "2025",
    "confiabilidade": "Alta; pesquisa probabilística nacional do DataSenado com 21.641 mulheres",
    "fonte_status": "conferida",
    "nivel": "Básico",
    "status": "publicado",
    "aprovacao": {
      "status": "aprovado",
      "aprovado_por": "Luiz Jácomo"
    },
    "destaque": false,
    "tags": [
      "gênero",
      "violência contra a mulher",
      "violência doméstica",
      "patriarcado",
      "direitos humanos"
    ]
  },
  {
    "versao_contrato": "1.0",
    "modelo_publico": "card_dados_v1",
    "id": "DAD-0010",
    "codigo_publicacao": "R002-C02",
    "evi_id": "EVI-mte-mmulheres-desigualdade-salarial-2026-s1",
    "tema_ids": [
      "genero",
      "trabalho"
    ],
    "editoria": "Notícias, dados e informações",
    "categoria": "Gênero, sexualidade e corpo",
    "subtema": "Desigualdade salarial e trabalho",
    "titulo": "Nas grandes empresas analisadas, mulheres receberam em média 21,3% menos que homens",
    "subtitulo": "O indicador reúne cerca de 53,5 mil estabelecimentos privados com cem ou mais empregados",
    "tipo": "Dados do trabalho",
    "resumo": "O 5º Relatório de Transparência Salarial apontou que a remuneração média das mulheres foi 21,3% menor que a dos homens nos estabelecimentos analisados. A base reúne cerca de 53,5 mil estabelecimentos privados com cem ou mais vínculos ativos. A diferença é agregada: não significa que toda mulher receba menos que um homem na mesma função, mas ajuda a observar desigualdades de acesso a ocupações, promoções, posições de chefia e setores mais bem remunerados.",
    "dado": "No 5º Relatório de Transparência Salarial, a remuneração média das mulheres foi 21,3% menor que a dos homens nos estabelecimentos analisados.",
    "contextualizacao": "A base reúne cerca de 53,5 mil estabelecimentos privados com cem ou mais vínculos ativos.",
    "interpretacao_sociosofia": "A diferença é agregada: não significa que toda mulher receba menos que um homem na mesma função, mas ajuda a observar desigualdades de acesso a ocupações, promoções, posições de chefia e setores mais bem remunerados.",
    "questao": "Como a distribuição desigual entre cargos, setores e posições de chefia contribui para a diferença média de remuneração entre mulheres e homens?",
    "conexoes": "Desigualdade salarial, divisão sexual do trabalho, segregação ocupacional, teto de vidro, autonomia econômica e interseccionalidade.",
    "conceitos": [
      "Desigualdade salarial",
      "Divisão sexual do trabalho",
      "Segregação ocupacional",
      "Interseccionalidade"
    ],
    "autores": [],
    "fonte_nome": "Ministério das Mulheres e Ministério do Trabalho e Emprego — 5º Relatório de Transparência Salarial",
    "fonte_url": "https://www.gov.br/mulheres/pt-br/central-de-conteudos/noticias/2026/abril/emprego-feminino-avanca-e-politicas-de-igualdade-salarial-se-ampliam-aponta-5o-relatorio-de-transparencia-salarial-1",
    "ano_data": "2026",
    "confiabilidade": "Alta; dados administrativos oficiais, com escopo restrito a estabelecimentos privados de maior porte",
    "fonte_status": "conferida",
    "nivel": "Intermediário",
    "status": "publicado",
    "aprovacao": {
      "status": "aprovado",
      "aprovado_por": "Luiz Jácomo"
    },
    "destaque": false,
    "tags": [
      "gênero",
      "trabalho",
      "desigualdade salarial",
      "divisão sexual do trabalho",
      "teto de vidro"
    ]
  },
  {
    "versao_contrato": "1.0",
    "modelo_publico": "card_dados_v1",
    "id": "DAD-0011",
    "codigo_publicacao": "R002-C03",
    "evi_id": "EVI-ibge-trabalho-domestico-cuidados-genero-2022",
    "tema_ids": [
      "genero",
      "trabalho"
    ],
    "editoria": "Notícias, dados e informações",
    "categoria": "Gênero, sexualidade e corpo",
    "subtema": "Trabalho doméstico, cuidado e desigualdade de tempo",
    "titulo": "Mulheres dedicaram quase o dobro do tempo de homens ao cuidado e aos afazeres domésticos",
    "subtitulo": "Em 2022, foram 21,3 horas semanais entre elas e 11,7 horas entre eles",
    "tipo": "Dado oficial",
    "resumo": "Em 2022, mulheres de 14 anos ou mais dedicaram, em média, 21,3 horas semanais a afazeres domésticos e cuidados de pessoas; entre os homens, foram 11,7 horas. O indicador reúne atividades realizadas sem remuneração direta. Esse trabalho mantém casas e pessoas, mas costuma permanecer invisível e desigualmente distribuído, reduzindo o tempo disponível para estudo, trabalho remunerado, descanso e participação pública.",
    "dado": "Em 2022, mulheres de 14 anos ou mais dedicaram, em média, 21,3 horas semanais a afazeres domésticos e cuidados; homens dedicaram 11,7 horas.",
    "contextualizacao": "O indicador considera pessoas de 14 anos ou mais e reúne atividades realizadas sem remuneração direta, como afazeres domésticos e cuidados de pessoas.",